{
  "meta": {
    "version": "1.0.0",
    "sourceFile": "operative_demo.blend",
    "fps": 24.0,
    "coordinateSystem": "pixi-y-down",
    "atlasTexture": "operative.atlas.png"
  },
  "bones": [
    {
      "name": "root",
      "parent": null,
      "length": 10.0,
      "restX": 0.0,
      "restY": -64.0,
      "restRotation": 0.0,
      "zIndex": 50
    },
    {
      "name": "torso",
      "parent": "root",
      "length": 42.0,
      "restX": 0.0,
      "restY": 0.0,
      "restRotation": -1.570796,
      "zIndex": 60
    },
    {
      "name": "head",
      "parent": "torso",
      "length": 24.0,
      "restX": 42.0,
      "restY": 0.0,
      "restRotation": 0.0,
      "zIndex": 70
    },
    {
      "name": "upper_arm_l",
      "parent": "torso",
      "length": 24.0,
      "restX": 36.0,
      "restY": 0.0,
      "restRotation": 3.141593,
      "zIndex": 5
    },
    {
      "name": "forearm_l",
      "parent": "upper_arm_l",
      "length": 24.0,
      "restX": 24.0,
      "restY": 0.0,
      "restRotation": -1.570796,
      "zIndex": 8
    },
    {
      "name": "upper_arm_r",
      "parent": "torso",
      "length": 26.0,
      "restX": 36.0,
      "restY": 0.0,
      "restRotation": 1.570796,
      "zIndex": 100
    },
    {
      "name": "forearm_r",
      "parent": "upper_arm_r",
      "length": 28.0,
      "restX": 26.0,
      "restY": 0.0,
      "restRotation": 0.0,
      "zIndex": 110
    },
    {
      "name": "thigh_l",
      "parent": "root",
      "length": 32.0,
      "restX": 0.0,
      "restY": 0.0,
      "restRotation": 1.570796,
      "zIndex": 10
    },
    {
      "name": "shin_l",
      "parent": "thigh_l",
      "length": 32.0,
      "restX": 32.0,
      "restY": 0.0,
      "restRotation": 0.0,
      "zIndex": 20
    },
    {
      "name": "thigh_r",
      "parent": "root",
      "length": 32.0,
      "restX": 0.0,
      "restY": 0.0,
      "restRotation": 1.570796,
      "zIndex": 30
    },
    {
      "name": "shin_r",
      "parent": "thigh_r",
      "length": 32.0,
      "restX": 32.0,
      "restY": 0.0,
      "restRotation": 0.0,
      "zIndex": 40
    }
  ],
  "sockets": [
    {
      "name": "head_top",
      "bone": "head",
      "x": 24.0,
      "y": 0.0,
      "rotation": 0.0
    },
    {
      "name": "muzzle",
      "bone": "forearm_r",
      "x": 37.0,
      "y": 0.0,
      "rotation": 0.0
    },
    {
      "name": "offhand_grip",
      "bone": "forearm_r",
      "x": 11.0,
      "y": 2.0,
      "rotation": 0.0
    },
    {
      "name": "thruster",
      "bone": "torso",
      "x": 25.0,
      "y": -12.0,
      "rotation": 0.0
    }
  ],
  "slots": [
    {
      "name": "slot_upper_arm_l",
      "bone": "upper_arm_l",
      "shapeType": "rect",
      "width": 24.0,
      "height": 9.0,
      "colorHex": "#0A0B0E",
      "strokeColorHex": "#F4F6F8",
      "offsetX": 12.0,
      "offsetY": 0.0,
      "zIndex": 5,
      "atlasRegion": {
        "texture": "operative.atlas.png",
        "x": 4,
        "y": 4,
        "width": 24,
        "height": 9
      }
    },
    {
      "name": "slot_forearm_l",
      "bone": "forearm_l",
      "shapeType": "rect",
      "width": 24.0,
      "height": 8.0,
      "colorHex": "#0A0B0E",
      "strokeColorHex": "#00F0FF",
      "offsetX": 12.0,
      "offsetY": 0.0,
      "zIndex": 8,
      "atlasRegion": {
        "texture": "operative.atlas.png",
        "x": 32,
        "y": 4,
        "width": 24,
        "height": 8
      }
    },
    {
      "name": "slot_thigh_l",
      "bone": "thigh_l",
      "shapeType": "rect",
      "width": 32.0,
      "height": 11.0,
      "colorHex": "#0A0B0E",
      "strokeColorHex": "#F4F6F8",
      "offsetX": 16.0,
      "offsetY": 0.0,
      "zIndex": 10,
      "atlasRegion": {
        "texture": "operative.atlas.png",
        "x": 60,
        "y": 4,
        "width": 32,
        "height": 11
      }
    },
    {
      "name": "slot_shin_l",
      "bone": "shin_l",
      "shapeType": "rect",
      "width": 32.0,
      "height": 9.0,
      "colorHex": "#0A0B0E",
      "strokeColorHex": "#00F0FF",
      "offsetX": 16.0,
      "offsetY": 0.0,
      "zIndex": 20,
      "atlasRegion": {
        "texture": "operative.atlas.png",
        "x": 96,
        "y": 4,
        "width": 32,
        "height": 9
      }
    },
    {
      "name": "slot_thigh_r",
      "bone": "thigh_r",
      "shapeType": "rect",
      "width": 32.0,
      "height": 12.0,
      "colorHex": "#F4F6F8",
      "strokeColorHex": "#0A0B0E",
      "offsetX": 16.0,
      "offsetY": 0.0,
      "zIndex": 30,
      "atlasRegion": {
        "texture": "operative.atlas.png",
        "x": 132,
        "y": 4,
        "width": 32,
        "height": 12
      }
    },
    {
      "name": "slot_shin_r",
      "bone": "shin_r",
      "shapeType": "rect",
      "width": 32.0,
      "height": 9.5,
      "colorHex": "#0A0B0E",
      "strokeColorHex": "#F4F6F8",
      "offsetX": 16.0,
      "offsetY": 0.0,
      "zIndex": 40,
      "atlasRegion": {
        "texture": "operative.atlas.png",
        "x": 168,
        "y": 4,
        "width": 32,
        "height": 10
      }
    },
    {
      "name": "slot_root_belt",
      "bone": "root",
      "shapeType": "rect",
      "width": 20.0,
      "height": 10.0,
      "colorHex": "#0A0B0E",
      "strokeColorHex": "#F4F6F8",
      "offsetX": 0.0,
      "offsetY": -2.0,
      "zIndex": 50,
      "atlasRegion": {
        "texture": "operative.atlas.png",
        "x": 204,
        "y": 4,
        "width": 20,
        "height": 10
      }
    },
    {
      "name": "slot_torso_plate",
      "bone": "torso",
      "shapeType": "rect",
      "width": 42.0,
      "height": 22.0,
      "colorHex": "#F4F6F8",
      "strokeColorHex": "#0A0B0E",
      "offsetX": 21.0,
      "offsetY": 0.0,
      "zIndex": 60,
      "atlasRegion": {
        "texture": "operative.atlas.png",
        "x": 4,
        "y": 20,
        "width": 42,
        "height": 22
      }
    },
    {
      "name": "slot_torso_thruster",
      "bone": "torso",
      "shapeType": "rect",
      "width": 16.0,
      "height": 6.0,
      "colorHex": "#00F0FF",
      "strokeColorHex": "#0A0B0E",
      "offsetX": 25.0,
      "offsetY": -9.0,
      "zIndex": 65,
      "atlasRegion": {
        "texture": "operative.atlas.png",
        "x": 50,
        "y": 20,
        "width": 16,
        "height": 6
      }
    },
    {
      "name": "slot_head_helmet",
      "bone": "head",
      "shapeType": "rect",
      "width": 24.0,
      "height": 20.0,
      "colorHex": "#0A0B0E",
      "strokeColorHex": "#F4F6F8",
      "offsetX": 12.0,
      "offsetY": 0.0,
      "zIndex": 70,
      "atlasRegion": {
        "texture": "operative.atlas.png",
        "x": 70,
        "y": 20,
        "width": 24,
        "height": 20
      }
    },
    {
      "name": "slot_head_visor",
      "bone": "head",
      "shapeType": "rect",
      "width": 7.0,
      "height": 13.0,
      "colorHex": "#00F0FF",
      "strokeColorHex": "#0A0B0E",
      "offsetX": 13.0,
      "offsetY": 6.0,
      "zIndex": 75,
      "atlasRegion": {
        "texture": "operative.atlas.png",
        "x": 98,
        "y": 20,
        "width": 7,
        "height": 13
      }
    },
    {
      "name": "slot_upper_arm_r",
      "bone": "upper_arm_r",
      "shapeType": "rect",
      "width": 26.0,
      "height": 9.5,
      "colorHex": "#F4F6F8",
      "strokeColorHex": "#0A0B0E",
      "offsetX": 13.0,
      "offsetY": 0.0,
      "zIndex": 100,
      "atlasRegion": {
        "texture": "operative.atlas.png",
        "x": 109,
        "y": 20,
        "width": 26,
        "height": 10
      }
    },
    {
      "name": "slot_forearm_r_carbine",
      "bone": "forearm_r",
      "shapeType": "rect",
      "width": 38.0,
      "height": 8.5,
      "colorHex": "#0A0B0E",
      "strokeColorHex": "#F4F6F8",
      "offsetX": 18.0,
      "offsetY": 0.0,
      "zIndex": 110,
      "atlasRegion": {
        "texture": "operative.atlas.png",
        "x": 139,
        "y": 20,
        "width": 38,
        "height": 9
      }
    },
    {
      "name": "slot_weapon_threat_accent",
      "bone": "forearm_r",
      "shapeType": "rect",
      "width": 24.0,
      "height": 3.5,
      "colorHex": "#FF2A54",
      "strokeColorHex": "#0A0B0E",
      "offsetX": 25.0,
      "offsetY": -1.5,
      "zIndex": 115,
      "atlasRegion": {
        "texture": "operative.atlas.png",
        "x": 181,
        "y": 20,
        "width": 24,
        "height": 4
      }
    }
  ],
  "ik_constraints": [
    {
      "name": "right_arm_aim",
      "chain": [
        "upper_arm_r",
        "forearm_r"
      ],
      "target": "aim_cursor",
      "bendDirection": 1,
      "autoFlipFacing": true,
      "mix": 1.0
    },
    {
      "name": "left_arm_grip",
      "chain": [
        "upper_arm_l",
        "forearm_l"
      ],
      "target": "offhand_grip",
      "bendDirection": 1,
      "autoFlipFacing": false,
      "mix": 1.0,
      "targetSocket": "offhand_grip"
    }
  ],
  "look_at_constraints": [
    {
      "name": "head_look_at",
      "bone": "head",
      "target": "aim_cursor",
      "mix": 0.55,
      "minAngle": -0.65,
      "maxAngle": 0.65
    }
  ],
  "animations": {
    "Idle": {
      "duration": 2.0,
      "loop": true,
      "tracks": {
        "root": [
          {
            "time": 0.0,
            "x": 0.0,
            "y": -64.0,
            "rotation": 0.0
          },
          {
            "time": 0.25,
            "x": 0.0,
            "y": -65.13137,
            "rotation": 0.0
          },
          {
            "time": 0.5,
            "x": 0.0,
            "y": -65.6,
            "rotation": 0.0
          },
          {
            "time": 0.75,
            "x": 0.0,
            "y": -65.13137,
            "rotation": 0.0
          },
          {
            "time": 1.0,
            "x": 0.0,
            "y": -64.0,
            "rotation": 0.0
          },
          {
            "time": 1.25,
            "x": 0.0,